{"acyclic":true,"edges":[{"kind":"defines","label":"components/app/component.md","source":"repository:child","target":"component:app"},{"kind":"repository-parent","label":"","source":"repository:root","target":"repository:child"}],"identity":"sha256:1ca04bdfdadca9a00390d4e4751cfdd574b81f0a95485b172153ad2c16492eb1","nodes":[{"id":"component:app","inheritable":true,"inherited":false,"kind":"component","label":"App","project_id":"child","properties":{"identity":"sha256:cccccccccccccccccccccccccccccccccccccccccccccccccccccccccccccccc"},"provenance":"components/app"},{"id":"repository:child","inheritable":true,"inherited":false,"kind":"repository","label":"Child","project_id":"child","properties":{"identity":"sha256:bbbbbbbbbbbbbbbbbbbbbbbbbbbbbbbbbbbbbbbbbbbbbbbbbbbbbbbbbbbbbbbb"},"provenance":"https://example.test/child.git"},{"id":"repository:root","inheritable":true,"inherited":true,"kind":"repository","label":"Root","project_id":"root","properties":{"identity":"sha256:aaaaaaaaaaaaaaaaaaaaaaaaaaaaaaaaaaaaaaaaaaaaaaaaaaaaaaaaaaaaaaaa"},"provenance":"https://example.test/root.git"}],"project_id":"child","schema":"literate-ai/authority-graph@2","topological_order":["repository:root","repository:child","component:app"]}
